{
  "schemaVersion": 1,
  "modelId": "landgut-lohn-v004",
  "coordinates": "gltf-y-up-meters",
  "views": [
    {
      "id": "site-overview",
      "title": "Estate and surroundings",
      "description": "Main house, Peristyl and Dependance in the terrain of the Lohn estate above Kehrsatz.",
      "camera": {
        "mode": "orbit",
        "frame": "site"
      }
    },
    {
      "id": "building-exterior",
      "title": "Main house and Dependance",
      "description": "The two buildings linked by the glazed Peristyl.",
      "camera": {
        "mode": "orbit",
        "frame": "building"
      }
    },
    {
      "id": "dollhouse-eg",
      "title": "Ground floor rooms",
      "description": "Dollhouse view of the ground floor: Halle, Salon, Fumoir, Kleines Esszimmer and the Speisesaal in the Dependance.",
      "camera": {
        "mode": "dollhouse",
        "level": "eg",
        "frame": "level"
      }
    },
    {
      "id": "dollhouse-og1",
      "title": "Upper floor rooms",
      "description": "Dollhouse view of the 1. OG: guest rooms around the Obere Halle.",
      "camera": {
        "mode": "dollhouse",
        "level": "og1",
        "frame": "level"
      }
    },
    {
      "id": "plan-eg",
      "title": "Ground floor plan",
      "description": "Plan view of the ground floor.",
      "camera": {
        "mode": "plan",
        "level": "eg",
        "frame": "level"
      }
    },
    {
      "id": "plan-og1",
      "title": "Upper floor plan",
      "description": "Plan view of the 1. OG.",
      "camera": {
        "mode": "plan",
        "level": "og1",
        "frame": "level"
      }
    }
  ],
  "pointsOfInterest": [
    {
      "id": "west-portico",
      "title": "West portico",
      "description": "Entrance front with four giant sandstone piers, the upper loggia balustrade and the segmental pediment.",
      "camera": {
        "mode": "orbit",
        "position": [
          -30.58,
          2.2,
          -3.99
        ],
        "target": [
          -19.08,
          5.5,
          -3.99
        ]
      }
    },
    {
      "id": "garden-front",
      "title": "Garden front",
      "description": "South facade with the central pediment and the terrace in front of the Grosser Salon.",
      "camera": {
        "mode": "orbit",
        "position": [
          -7.78,
          3.0,
          27.16
        ],
        "target": [
          -7.78,
          5.0,
          1.16
        ]
      }
    },
    {
      "id": "peristyl-courtyard",
      "title": "Peristyl",
      "description": "The glazed passage of 1959/60 between the main house and the Dependance.",
      "camera": {
        "mode": "orbit",
        "position": [
          9.92,
          3.5,
          9.16
        ],
        "target": [
          9.92,
          2.0,
          -3.99
        ]
      }
    },
    {
      "id": "salon",
      "title": "Grosser Salon",
      "description": "The principal reception room behind the garden front, with its round faience stove.",
      "camera": {
        "mode": "dollhouse",
        "position": [
          -7.78,
          11.0,
          9.16
        ],
        "target": [
          -7.78,
          2.0,
          0.56
        ],
        "level": "eg"
      }
    },
    {
      "id": "speisesaal",
      "title": "Speisesaal",
      "description": "The dining hall in the former stables of the Dependance.",
      "camera": {
        "mode": "dollhouse",
        "position": [
          16.92,
          10.0,
          2.16
        ],
        "target": [
          23.92,
          1.0,
          -4.34
        ],
        "level": "eg"
      }
    },
    {
      "id": "stair-hall",
      "title": "Stair hall",
      "description": "Open-well stone stair behind the Tuscan columns of the Halle.",
      "camera": {
        "mode": "dollhouse",
        "position": [
          -7.78,
          12.0,
          -0.84
        ],
        "target": [
          -7.78,
          3.0,
          -8.34
        ],
        "level": "eg"
      }
    },
    {
      "id": "churchill-zimmer",
      "title": "Churchill-Zimmer",
      "description": "The large guest room in the north-east corner (Churchill stayed at Lohn in 1946).",
      "camera": {
        "mode": "dollhouse",
        "position": [
          -5.08,
          15.0,
          -0.84
        ],
        "target": [
          -1.08,
          6.0,
          -8.04
        ],
        "level": "og1"
      }
    }
  ],
  "objects": [
    {
      "id": "lohn-main-roof",
      "title": "Main roof",
      "properties": [
        {
          "label": "Measured",
          "value": "Hipped roof with a flatter eave kick; upper planes about 38 deg, eave planes about 26 deg",
          "basis": "measured",
          "source": "Planes fitted to the swissSURFACE3D 2023 point cloud; median deviation of the model roof from the points below 0.02 m, 88 % of points within 0.15 m."
        },
        {
          "label": "Covering",
          "value": "Clay plain tiles (texture generic)",
          "basis": "inferred",
          "confidence": "medium",
          "source": "Roof colour from the 2024 orthophoto; tile type not documented."
        }
      ]
    },
    {
      "id": "lohn-main-roof-pediment-w",
      "title": "Segmental pediment",
      "properties": [
        {
          "label": "Shape",
          "value": "Segmental pediment over the west portico; cartouche not modelled",
          "basis": "inferred",
          "confidence": "medium",
          "source": "2019 tour (Vorplatz panorama) and LiDAR apex 575.65 m a.s.l."
        }
      ]
    },
    {
      "id": "lohn-main-stair-eg-og1",
      "title": "Main stair",
      "properties": [
        {
          "label": "Geometry",
          "value": "Open-well stair, 30 risers EG to 1. OG (about 0.136 m)",
          "basis": "inferred",
          "confidence": "medium",
          "source": "Plan treads and well outline (2005); storey height 4.09 m measured from the stair panorama; riser count derived."
        }
      ]
    },
    {
      "id": "lohn-dependance-eg-floor-speisesaal",
      "title": "Speisesaal floor",
      "properties": [
        {
          "label": "Room",
          "value": "Former stables, now the dining hall; oak parquet, net area 67.3 m2 modelled vs 67.95 m2 on the plan",
          "basis": "inferred",
          "confidence": "medium",
          "source": "Plan 2005 room outline and label; floor finish from the 2019 tour."
        }
      ]
    },
    {
      "id": "lohn-main-house-og1-stove-02",
      "title": "Tiled stove",
      "properties": [
        {
          "label": "Source",
          "value": "Kachelofen in the Churchill-Zimmer; outline from the floor plan, height and colour from the 2019 tour",
          "basis": "inferred",
          "confidence": "medium",
          "source": "Plan 2005 fixture outline; panorama of the Grosses Schlafzimmer."
        }
      ]
    },
    {
      "id": "lohn-per-eg-frame",
      "title": "Peristyl",
      "properties": [
        {
          "label": "Date",
          "value": "Glazed gallery built 1959/60",
          "basis": "inferred",
          "confidence": "medium",
          "source": "Competition programme 2024 chronology (BBL)."
        },
        {
          "label": "Geometry",
          "value": "Six posts per side at 2.31 m centres; gable roof 19 deg",
          "basis": "measured",
          "source": "Plan 2005 and swissSURFACE3D 2023."
        }
      ]
    }
  ]
}
