{
  "schemaVersion": 1,
  "modelId": "villa-maraini-v003",
  "coordinates": "gltf-y-up-meters",
  "views": [
    {
      "id": "exterior",
      "title": "Archive architectural study",
      "description": "Archive architectural study with Lazio 2002 terrain and schematic OSM surroundings; provisional vertical placement.",
      "camera": {
        "mode": "orbit",
        "position": [
          45,
          38,
          58
        ],
        "target": [
          -1,
          7,
          0
        ]
      }
    },
    {
      "id": "dollhouse-p1",
      "title": "Piano 1 · Interrato",
      "description": "Partial major-wall layout; some thin partitions and details remain unresolved.",
      "camera": {
        "mode": "dollhouse",
        "level": "p1",
        "frame": "level"
      }
    },
    {
      "id": "dollhouse-p2",
      "title": "Piano 2 · Seminterrato",
      "description": "Partial major-wall layout; some thin partitions and details remain unresolved.",
      "camera": {
        "mode": "dollhouse",
        "level": "p2",
        "frame": "level"
      }
    },
    {
      "id": "dollhouse-p3",
      "title": "Piano 3 · Rialzato",
      "description": "Partial major-wall layout; some thin partitions and details remain unresolved.",
      "camera": {
        "mode": "dollhouse",
        "level": "p3",
        "frame": "level"
      }
    },
    {
      "id": "dollhouse-p4",
      "title": "Piano 4 · Primo",
      "description": "Partial major-wall layout; some thin partitions and details remain unresolved.",
      "camera": {
        "mode": "dollhouse",
        "level": "p4",
        "frame": "level"
      }
    },
    {
      "id": "dollhouse-p5",
      "title": "Piano 5 · Secondo",
      "description": "Partial major-wall layout; some thin partitions and details remain unresolved.",
      "camera": {
        "mode": "dollhouse",
        "level": "p5",
        "frame": "level"
      }
    },
    {
      "id": "dollhouse-p6",
      "title": "Piano 6 · Torretta inferiore",
      "description": "Partial major-wall layout; some thin partitions and details remain unresolved.",
      "camera": {
        "mode": "dollhouse",
        "level": "p6",
        "frame": "level"
      }
    },
    {
      "id": "dollhouse-p7",
      "title": "Piano 7 · Torretta superiore",
      "description": "Partial major-wall layout; some thin partitions and details remain unresolved.",
      "camera": {
        "mode": "dollhouse",
        "level": "p7",
        "frame": "level"
      }
    },
    {
      "id": "plan-p3",
      "title": "Piano rialzato plan",
      "description": "Calibrated major-wall layout from the archival booklet; thin partitions remain incomplete.",
      "camera": {
        "mode": "plan",
        "level": "p3",
        "frame": "level"
      }
    },
    {
      "id": "site-context",
      "title": "Villa and hill",
      "description": "5 m ground data; 99 GBA inferred context heights, five levels-derived, one 10 m default. Ground-to-floor tie remains provisional.",
      "camera": {
        "mode": "orbit",
        "position": [
          140,
          125,
          165
        ],
        "target": [
          0,
          -1,
          0
        ]
      }
    }
  ],
  "pointsOfInterest": [],
  "objects": []
}
